{
  "schema_version": 1,
  "run_id": "run_018f6b6e-8a2e-7c3a-8b2a-6d1e2f3a4b5c",
  "state": "running",
  "state_version": 3,
  "agent": {
    "id": "support.agent",
    "version": "1.2.3",
    "skill_id": "answer",
    "manifest_digest": "sha256:aaaaaaaaaaaaaaaaaaaaaaaaaaaaaaaaaaaaaaaaaaaaaaaaaaaaaaaaaaaaaaaa"
  },
  "authorization_snapshot_digest": "sha256:bbbbbbbbbbbbbbbbbbbbbbbbbbbbbbbbbbbbbbbbbbbbbbbbbbbbbbbbbbbbbbbb",
  "created_at": "2026-09-27T09:00:00Z",
  "updated_at": "2026-09-27T09:00:02Z",
  "deadline_at": "2026-09-27T09:15:00Z",
  "trace": {"traceparent": "00-4bf92f3577b34da6a3ce929d0e0e4736-00f067aa0ba902b7-01"}
}
